{
  "schema_version": "utrace_preview_route_record_v1",
  "preview_route_id": "0192f3c4-d345-7b8d-806e-92a3b4c5d6e7",
  "client_id": "0192f3c4-8a21-7c3e-9b6a-1d2e3f405162",
  "interview_session_id": "0192f3c4-9b10-7d4f-8c2a-5e6f70819243",
  "product_signal_id": "0192f3c4-a012-7e5a-9d3b-6f708192a3b4",
  "preview_version_id": "0192f3c4-b123-7f6b-ae4c-708192a3b4c5",
  "preview_runtime_allocation_id": "0192f3c4-c234-7a7c-bf5d-8192a3b4c5d6",
  "public_preview_host": "k7m2q9x4v1z8.preview.utrace.dev",
  "route_revision": 4,
  "readiness_state": "ready",
  "upstream": {
    "port_url": "https://sb-3kzofdocan9x.vercel.run",
    "application_port": 3000
  },
  "preview_entry_token": "pe_9Rb4Nk8Jd3Lf0Pw5Ag1Ts6Yh2Qm7Zx",
  "route_context_signing_secret": "Rt7Yh2Qm9Zx4Cb8Nv1Ks6Jd3Lf0Pw5Ag",
  "expires_at": "2026-10-03T18:05:00Z"
}
